{
  "platformId": "meta-ads",
  "platformName": "Meta Ads: Facebook / Instagram",
  "generatedAt": "2026-07-09T00:00:00.000Z",
  "source": {
    "mode": "registry-template",
    "checkedAt": "2026-07-09T00:00:00.000Z",
    "scope": "Publishable field-value template only; no authenticated account objects included.",
    "caveats": [
      "Platform-visible value; availability may vary by account, locale, campaign type, and policy."
    ]
  },
  "fields": [
    { "fieldId": "geography", "label": "Location", "inputKeys": ["locale", "geographies"], "status": "ready-for-values", "values": [] },
    { "fieldId": "interest", "label": "Interests", "inputKeys": ["interests", "industries", "topics"], "status": "ready-for-values", "values": [] },
    { "fieldId": "behavior", "label": "Behaviors", "inputKeys": ["interests", "intentSignals"], "status": "ready-for-values", "values": [] },
    { "fieldId": "demographics", "label": "Demographics", "inputKeys": ["demographics", "education", "lifeEvents"], "status": "ready-for-values", "values": [] }
  ]
}
