{
  "platformId": "google-ads-youtube",
  "platformName": "Google Ads / YouTube",
  "generatedAt": "2026-07-09T16:50:50.487Z",
  "source": {
    "mode": "official-doc-curated",
    "checkedAt": "2026-07-09",
    "scope": "Curated official documentation categories only; no credentials, account objects, or raw API responses included.",
    "caveats": [
      "Official Google Ads API documentation confirms these targeting families, but exact selectable values may require API metadata queries."
    ]
  },
  "fields": [
    {
      "fieldId": "geography",
      "label": "Location",
      "inputKeys": [
        "locale",
        "geographies"
      ],
      "status": "manual-reviewed",
      "values": [
        {
          "label": "Geo target constant",
          "status": "manual-reviewed",
          "checkedAt": "2026-07-09",
          "source": "official-doc",
          "sourceUrl": "https://developers.google.com/google-ads/api/docs/targeting/overview",
          "sourceCheckedAt": "2026-07-09",
          "sourceLabel": "Google Ads API targeting overview",
          "confidence": "high",
          "caveats": [
            "Official Google Ads API documentation confirms these targeting families, but exact selectable values may require API metadata queries."
          ]
        },
        {
          "label": "Campaign location criterion",
          "status": "manual-reviewed",
          "checkedAt": "2026-07-09",
          "source": "official-doc",
          "sourceUrl": "https://developers.google.com/google-ads/api/docs/targeting/overview",
          "sourceCheckedAt": "2026-07-09",
          "sourceLabel": "Google Ads API targeting overview",
          "confidence": "high",
          "caveats": [
            "Official Google Ads API documentation confirms these targeting families, but exact selectable values may require API metadata queries."
          ]
        }
      ]
    },
    {
      "fieldId": "keyword",
      "label": "Keywords",
      "inputKeys": [
        "keywords",
        "industries"
      ],
      "status": "manual-reviewed",
      "values": [
        {
          "label": "Keyword criterion",
          "status": "manual-reviewed",
          "checkedAt": "2026-07-09",
          "source": "official-doc",
          "sourceUrl": "https://developers.google.com/google-ads/api/docs/targeting/overview",
          "sourceCheckedAt": "2026-07-09",
          "sourceLabel": "Google Ads API targeting overview",
          "confidence": "high",
          "caveats": [
            "Official Google Ads API documentation confirms these targeting families, but exact selectable values may require API metadata queries."
          ]
        },
        {
          "label": "Keyword planning idea",
          "status": "manual-reviewed",
          "checkedAt": "2026-07-09",
          "source": "official-doc",
          "sourceUrl": "https://developers.google.com/google-ads/api/docs/targeting/overview",
          "sourceCheckedAt": "2026-07-09",
          "sourceLabel": "Google Ads API targeting overview",
          "confidence": "high",
          "caveats": [
            "Official Google Ads API documentation confirms these targeting families, but exact selectable values may require API metadata queries."
          ]
        }
      ]
    },
    {
      "fieldId": "customSegment",
      "label": "Custom segments",
      "inputKeys": [
        "keywords",
        "interests",
        "industries",
        "placements",
        "topics"
      ],
      "status": "manual-reviewed",
      "values": [
        {
          "label": "Custom segment",
          "status": "manual-reviewed",
          "checkedAt": "2026-07-09",
          "source": "official-doc",
          "sourceUrl": "https://developers.google.com/google-ads/api/docs/targeting/overview",
          "sourceCheckedAt": "2026-07-09",
          "sourceLabel": "Google Ads API targeting overview",
          "confidence": "medium",
          "caveats": [
            "Official Google Ads API documentation confirms these targeting families, but exact selectable values may require API metadata queries."
          ]
        },
        {
          "label": "Placement signal",
          "status": "manual-reviewed",
          "checkedAt": "2026-07-09",
          "source": "official-doc",
          "sourceUrl": "https://developers.google.com/google-ads/api/docs/targeting/overview",
          "sourceCheckedAt": "2026-07-09",
          "sourceLabel": "Google Ads API targeting overview",
          "confidence": "medium",
          "caveats": [
            "Official Google Ads API documentation confirms these targeting families, but exact selectable values may require API metadata queries."
          ]
        },
        {
          "label": "Topic signal",
          "status": "manual-reviewed",
          "checkedAt": "2026-07-09",
          "source": "official-doc",
          "sourceUrl": "https://developers.google.com/google-ads/api/docs/targeting/overview",
          "sourceCheckedAt": "2026-07-09",
          "sourceLabel": "Google Ads API targeting overview",
          "confidence": "medium",
          "caveats": [
            "Official Google Ads API documentation confirms these targeting families, but exact selectable values may require API metadata queries."
          ]
        }
      ]
    },
    {
      "fieldId": "inMarket",
      "label": "In-market audiences",
      "inputKeys": [
        "industries",
        "interests"
      ],
      "status": "manual-reviewed",
      "values": [
        {
          "label": "In-market audience",
          "status": "manual-reviewed",
          "checkedAt": "2026-07-09",
          "source": "official-doc",
          "sourceUrl": "https://developers.google.com/google-ads/api/docs/targeting/overview",
          "sourceCheckedAt": "2026-07-09",
          "sourceLabel": "Google Ads API targeting overview",
          "confidence": "medium",
          "caveats": [
            "Official Google Ads API documentation confirms these targeting families, but exact selectable values may require API metadata queries."
          ]
        }
      ]
    },
    {
      "fieldId": "affinity",
      "label": "Affinity audiences",
      "inputKeys": [
        "interests"
      ],
      "status": "manual-reviewed",
      "values": [
        {
          "label": "Affinity audience",
          "status": "manual-reviewed",
          "checkedAt": "2026-07-09",
          "source": "official-doc",
          "sourceUrl": "https://developers.google.com/google-ads/api/docs/targeting/overview",
          "sourceCheckedAt": "2026-07-09",
          "sourceLabel": "Google Ads API targeting overview",
          "confidence": "low",
          "caveats": [
            "Official Google Ads API documentation confirms these targeting families, but exact selectable values may require API metadata queries."
          ]
        }
      ]
    },
    {
      "fieldId": "detailedDemographics",
      "label": "Detailed demographics / life events",
      "inputKeys": [
        "demographics",
        "education",
        "lifeEvents"
      ],
      "status": "manual-reviewed",
      "values": [
        {
          "label": "Detailed demographic",
          "status": "manual-reviewed",
          "checkedAt": "2026-07-09",
          "source": "official-doc",
          "sourceUrl": "https://developers.google.com/google-ads/api/docs/targeting/overview",
          "sourceCheckedAt": "2026-07-09",
          "sourceLabel": "Google Ads API targeting overview",
          "confidence": "low",
          "caveats": [
            "Official Google Ads API documentation confirms these targeting families, but exact selectable values may require API metadata queries."
          ]
        },
        {
          "label": "Life event",
          "status": "manual-reviewed",
          "checkedAt": "2026-07-09",
          "source": "official-doc",
          "sourceUrl": "https://developers.google.com/google-ads/api/docs/targeting/overview",
          "sourceCheckedAt": "2026-07-09",
          "sourceLabel": "Google Ads API targeting overview",
          "confidence": "low",
          "caveats": [
            "Official Google Ads API documentation confirms these targeting families, but exact selectable values may require API metadata queries."
          ]
        }
      ]
    },
    {
      "fieldId": "device",
      "label": "Device targeting",
      "inputKeys": [
        "devices"
      ],
      "status": "manual-reviewed",
      "values": [
        {
          "label": "Device criterion",
          "status": "manual-reviewed",
          "checkedAt": "2026-07-09",
          "source": "official-doc",
          "sourceUrl": "https://developers.google.com/google-ads/api/docs/targeting/overview",
          "sourceCheckedAt": "2026-07-09",
          "sourceLabel": "Google Ads API targeting overview",
          "confidence": "high",
          "caveats": [
            "Official Google Ads API documentation confirms these targeting families, but exact selectable values may require API metadata queries."
          ]
        }
      ]
    }
  ]
}
